<?xml version="1.0" encoding="UTF-8"?>
<MODITEMESTOQUE xmlns:xsi="http://www.w3.org/2001/XMLSchema-instance" xsi:noNamespaceSchemaLocation="EcalcIntegraEAI_ITEMESTOQUE.xsd">
  <ITEMESTOQUE OPERACAOINTEGRACAO="">
    <ID>
      <value>value</value>
    </ID>
    <NOME>
      <value>value</value>
    </NOME>
    <DESCRICAO>
      <value>value</value>
    </DESCRICAO>
    <ATIVO>
      <value>value</value>
    </ATIVO>
    <CODCLIENTE>
      <value>value</value>
    </CODCLIENTE>
    <ITEMPROD>
      <value>value</value>
    </ITEMPROD>
    <TIPOITEMEC>
      <value>value</value>
    </TIPOITEMEC>
    <PAPELFAMILIA>
      <value>value</value>
    </PAPELFAMILIA>
    <PAPELGRAMATURA>
      <value>0</value>
    </PAPELGRAMATURA>
    <PAPELLARGURA>
      <value>0</value>
    </PAPELLARGURA>
    <PAPELALTURA>
      <value>0</value>
    </PAPELALTURA>
  </ITEMESTOQUE>
</MODITEMESTOQUE>
